{
  "project_id": "proj-new-house-001",
  "project_name": "New House",
  "land_info": {
    "boundary_points": [
      [0.0, 0.0],
      [50.0, 0.0],
      [50.0, 60.0],
      [0.0, 60.0]
    ],
    "area_sqft": 3000.0,
    "orientation": "North-East",
    "road_facing": "North"
  },
  "buildable_footprint": {
    "polygon": [
      [5.0, 5.0],
      [45.0, 5.0],
      [45.0, 55.0],
      [5.0, 55.0]
    ]
  },
  "floor_plan": {
    "rooms": [
      {
        "id": "room-living",
        "name": "Living Room",
        "type": "living",
        "polygon": [
          [5.0, 5.0],
          [25.0, 5.0],
          [25.0, 20.0],
          [5.0, 20.0]
        ]
      },
      {
        "id": "room-kitchen",
        "name": "Kitchen",
        "type": "kitchen",
        "polygon": [
          [25.0, 5.0],
          [45.0, 5.0],
          [45.0, 20.0],
          [25.0, 20.0]
        ]
      },
      {
        "id": "room-master-bedroom",
        "name": "Master Bedroom",
        "type": "master_bedroom",
        "polygon": [
          [5.0, 20.0],
          [25.0, 20.0],
          [25.0, 35.0],
          [5.0, 35.0]
        ]
      },
      {
        "id": "room-bedroom-2",
        "name": "Bedroom 2",
        "type": "bedroom",
        "polygon": [
          [25.0, 20.0],
          [35.0, 20.0],
          [35.0, 35.0],
          [25.0, 35.0]
        ]
      },
      {
        "id": "room-bedroom-3",
        "name": "Bedroom 3",
        "type": "bedroom",
        "polygon": [
          [5.0, 35.0],
          [25.0, 35.0],
          [25.0, 50.0],
          [5.0, 50.0]
        ]
      },
      {
        "id": "room-bathroom",
        "name": "Common Bathroom",
        "type": "bathroom",
        "polygon": [
          [35.0, 20.0],
          [45.0, 20.0],
          [45.0, 30.0],
          [35.0, 30.0]
        ]
      },
      {
        "id": "room-pooja",
        "name": "Pooja Room",
        "type": "pooja",
        "polygon": [
          [25.0, 35.0],
          [35.0, 35.0],
          [35.0, 45.0],
          [25.0, 45.0]
        ]
      }
    ],
    "structural_elements": [
      {
        "id": "col-1",
        "type": "column",
        "polygon": [
          [5.0, 5.0],
          [6.0, 5.0],
          [6.0, 6.0],
          [5.0, 6.0]
        ]
      },
      {
        "id": "col-2",
        "type": "column",
        "polygon": [
          [45.0, 5.0],
          [46.0, 5.0],
          [46.0, 6.0],
          [45.0, 6.0]
        ]
      },
      {
        "id": "col-3",
        "type": "column",
        "polygon": [
          [5.0, 50.0],
          [6.0, 50.0],
          [6.0, 51.0],
          [5.0, 51.0]
        ]
      },
      {
        "id": "col-4",
        "type": "column",
        "polygon": [
          [45.0, 50.0],
          [46.0, 50.0],
          [46.0, 51.0],
          [45.0, 51.0]
        ]
      }
    ]
  },
  "structural_rectification": {},
  "interior_layout": {
    "style": "modern",
    "color_theme": [
      "white",
      "light_grey",
      "wood_brown"
    ],
    "features": [
      "modern_furniture",
      "large_windows",
      "natural_lighting",
      "open_living_area",
      "built_in_kitchen_cabinets"
    ]
  },
  "exterior_landscape": {
    "style": "modern",
    "features": [
      "front_garden",
      "paved_walkway",
      "small_lawn",
      "front_entrance",
      "decorative_plants"
    ]
  },
  "processing": {
    "gab_gen": {
      "status": "completed"
    },
    "vsai_rectifier": {
      "status": "pending"
    },
    "esai_engine": {
      "status": "pending"
    },
    "elia_engine": {
      "status": "pending"
    }
  }
}