{"project_id": "custom-upload", "project_name": "Sample House", "land_info": {"orientation": "north"}, "buildable_footprint": {"source": "baseline"}, "floor_plan": {"rooms": [{"id": "living", "name": "Living", "polygon": [[0, 0], [4, 0], [4, 4], [0, 4]]}, {"id": "bedroom", "name": "Bedroom", "polygon": [[4, 0], [8, 0], [8, 4], [4, 4]]}], "structural_elements": [{"id": "column-1", "polygon": [[1, 1], [1.2, 1], [1.2, 1.2], [1, 1.2]]}]}, "structural_rectification": {}, "interior_layout": {"furniture": ["sofa"]}, "exterior_landscape": {"garden": true}, "processing": {"gab_gen": {"status": "completed"}, "vsai_rectifier": {"status": "pending"}, "esai_engine": {"status": "pending"}, "elia_engine": {"status": "pending"}}}